	Unnamed: 0	entry_ac	do_id	name	descr
1298	1298	Q8WYQ5	162	cancer	A disease of cellular proliferation that is malignant and primary, characterized by uncontrolled cellular proliferation, local cell invasion and metastasis.
5588	5588	P46939	162	cancer	A disease of cellular proliferation that is malignant and primary, characterized by uncontrolled cellular proliferation, local cell invasion and metastasis.
12620	12620	P46939	5419	schizophrenia	A psychotic disorder that is characterized by a disintegration of thought processes and of emotional responsiveness.
17976	17976	Q8WYQ5	1240	leukemia	A cancer that affects the blood or bone marrow characterized by an abnormal proliferation of blood cells.
19775	19775	P46939	1240	leukemia	A cancer that affects the blood or bone marrow characterized by an abnormal proliferation of blood cells.
31139	31139	P46939	9884	muscular dystrophy	A myopathy is characterized by progressive skeletal muscle weakness degeneration.
32420	32420	P46939	11723	Duchenne muscular dystrophy	A muscular dystrophy that has_material_basis_in X-linked mutations in the DMD gene found on the X chromosome. It is characterized by rapidly progressing muscle weakness and muscle atrophy initially involving the lower extremities and eventually affecting the whole body. It affects males whereas females can be carriers. The symptoms start before the age of six and may appear at infancy.
44654	44654	Q8WYQ5	12583	velocardiofacial syndrome	A chromosomal disease that has_material_basis_in deletion polymorphisms at chromosome location 22q11 and is characterized by variable developmental problems and schizoid features.
44667	44667	Q8WYQ5	11198	DiGeorge syndrome	A T cell deficiency disease that is the result of a large deletion of chromosome 22 which includes the DGS gene needed for development of the thymus and related glands with subsequent lack of T-cell production.
