	entry_ac	do_id	name	descr
1724	Q13526	162	cancer	A disease of cellular proliferation that is malignant and primary, characterized by uncontrolled cellular proliferation, local cell invasion and metastasis.
16999	Q13526	305	carcinoma	A cell type cancer that has_material_basis_in abnormally proliferating cells derives_from epithelial cells.
26761	Q13526	684	hepatocellular carcinoma	A liver carcinoma that has_material_basis_in undifferentiated hepatocytes and located_in the liver.
42865	Q13526	0050771	pheochromocytoma	An endocrine organ benign neoplasm that arises within the adrenal medulla, releasing epinephrines and norepinephrines hormones that cause either episodic or persistent high blood pressure.
45331	Q13526	2583	agammaglobulinemia	A B cell deficiency that is caused by a reduction in all types of gamma globulins.
